{
  "deck_key": "uber-india",
  "presentation_id": "1I-QTXOLN2KExoR7e6qYFqL03lBo2MAA45sw3zMkw1Kg",
  "source": "live_google_slides_pr65_content_applied",
  "slide_count": 11,
  "page_size": {
    "width": {
      "magnitude": 9144000,
      "unit": "EMU"
    },
    "height": {
      "magnitude": 5143500,
      "unit": "EMU"
    }
  },
  "object_inventory_status": "full_inventory_pulled",
  "slides": [
    {
      "index": 1,
      "slide_object_id": "p1",
      "layout_object_id": "p22",
      "title": "Uber × Navier — India's ride-hail leader, on the water",
      "purpose": "hero",
      "locked": false,
      "allowed_edit_types": [
        "text_replace",
        "image_replace",
        "speaker_notes_update",
        "layout_preserving_insert"
      ],
      "known_objects": [
        {
          "object_id": "p1_i2",
          "kind": "image",
          "transform": {
            "scaleX": 182.88,
            "scaleY": 182.88,
            "unit": "EMU"
          },
          "size": {
            "width": {
              "magnitude": 50000,
              "unit": "EMU"
            },
            "height": {
              "magnitude": 28125,
              "unit": "EMU"
            }
          }
        },
        {
          "object_id": "p1_i3",
          "kind": "image",
          "transform": {
            "scaleX": 228.6,
            "scaleY": 70.53942857142857,
            "unit": "EMU"
          },
          "size": {
            "width": {
              "magnitude": 40000,
              "unit": "EMU"
            },
            "height": {
              "magnitude": 17500,
              "unit": "EMU"
            }
          }
        },
        {
          "object_id": "p1_i4",
          "kind": "image",
          "transform": {
            "scaleX": 37.57806818181818,
            "scaleY": 37.578082191780815,
            "translateX": 502920,
            "translateY": 384048,
            "unit": "EMU"
          },
          "size": {
            "width": {
              "magnitude": 44000,
              "unit": "EMU"
            },
            "height": {
              "magnitude": 7300,
              "unit": "EMU"
            }
          }
        },
        {
          "object_id": "p1_i5",
          "kind": "image",
          "transform": {
            "scaleX": 33.85302857142857,
            "scaleY": 33.85303822937626,
            "translateX": 7456223,
            "translateY": 329184,
            "unit": "EMU"
          },
          "size": {
            "width": {
              "magnitude": 35000,
              "unit": "EMU"
            },
            "height": {
              "magnitude": 12425,
              "unit": "EMU"
            }
          }
        },
        {
          "object_id": "p1_i6",
          "kind": "shape",
          "transform": {
            "scaleX": 2.6822399999999997,
            "scaleY": 0.12192,
            "translateX": 548640,
            "translateY": 2788920,
            "unit": "EMU"
          },
          "size": {
            "width": {
              "magnitude": 3000000,
              "unit": "EMU"
            },
            "height": {
              "magnitude": 3000000,
              "unit": "EMU"
            }
          }
        },
        {
          "object_id": "p1_i7",
          "kind": "shape",
          "transform": {
            "scaleX": 0.4572,
            "scaleY": 0.01,
            "translateX": 566928,
            "translateY": 3218688,
            "unit": "EMU"
          },
          "size": {
            "width": {
              "magnitude": 3000000,
              "unit": "EMU"
            },
            "height": {
              "magnitude": 3000000,
              "unit": "EMU"
            }
          }
        },
        {
          "object_id": "p1_i8",
          "kind": "shape",
          "transform": {
            "scaleX": 2.7127,
            "scaleY": 0.1693,
            "translateX": 548640,
            "translateY": 3346704,
            "unit": "EMU"
          },
          "size": {
            "width": {
              "magnitude": 3000000,
              "unit": "EMU"
            },
            "height": {
              "magnitude": 3000000,
              "unit": "EMU"
            }
          }
        },
        {
          "object_id": "p1_i9",
          "kind": "shape",
          "transform": {
            "scaleX": 2.71272,
            "scaleY": 0.1524,
            "translateX": 566928,
            "translateY": 4526280,
            "unit": "EMU"
          },
          "size": {
            "width": {
              "magnitude": 3000000,
              "unit": "EMU"
            },
            "height": {
              "magnitude": 3000000,
              "unit": "EMU"
            }
          }
        },
        {
          "object_id": "p1_i10",
          "kind": "shape",
          "transform": {
            "scaleX": 2.71272,
            "scaleY": 0.0762,
            "translateX": 566928,
            "translateY": 4956048,
            "unit": "EMU"
          },
          "size": {
            "width": {
              "magnitude": 3000000,
              "unit": "EMU"
            },
            "height": {
              "magnitude": 3000000,
              "unit": "EMU"
            }
          }
        }
      ],
      "notes": "PR65 content applied; trimmed from Grab sandbox."
    },
    {
      "index": 2,
      "slide_object_id": "g3f139a0b6ec_0_0",
      "layout_object_id": "p23",
      "title": "Why Uber India",
      "purpose": "why-partner",
      "locked": false,
      "allowed_edit_types": [
        "text_replace",
        "image_replace",
        "speaker_notes_update",
        "layout_preserving_insert"
      ],
      "known_objects": [
        {
          "object_id": "g3f139a0b6ec_0_1",
          "kind": "image",
          "transform": {
            "scaleX": 192.625,
            "scaleY": 192.625,
            "translateX": -101174.5,
            "translateY": -51449.825,
            "unit": "EMU"
          },
          "size": {
            "width": {
              "magnitude": 48000,
              "unit": "EMU"
            },
            "height": {
              "magnitude": 27200,
              "unit": "EMU"
            }
          }
        },
        {
          "object_id": "g3f139a0b6ec_0_2",
          "kind": "shape",
          "transform": {
            "scaleX": 2.728,
            "scaleY": 0.2668,
            "translateX": 273450,
            "translateY": 117025,
            "unit": "EMU"
          },
          "size": {
            "width": {
              "magnitude": 3000000,
              "unit": "EMU"
            },
            "height": {
              "magnitude": 3000000,
              "unit": "EMU"
            }
          }
        },
        {
          "object_id": "g3f139a0b6ec_0_3",
          "kind": "shape",
          "transform": {
            "scaleX": 2.2398,
            "scaleY": 0.1488,
            "translateX": 319950,
            "translateY": 752487.8200000001,
            "unit": "EMU"
          },
          "size": {
            "width": {
              "magnitude": 3000000,
              "unit": "EMU"
            },
            "height": {
              "magnitude": 3000000,
              "unit": "EMU"
            }
          }
        },
        {
          "object_id": "g3f139a0b6ec_0_4",
          "kind": "shape",
          "transform": {
            "scaleX": 0.3961,
            "scaleY": 0.1488,
            "translateX": 3216598.5300000003,
            "translateY": 3758400,
            "unit": "EMU"
          },
          "size": {
            "width": {
              "magnitude": 3000000,
              "unit": "EMU"
            },
            "height": {
              "magnitude": 3000000,
              "unit": "EMU"
            }
          }
        },
        {
          "object_id": "g3f139a0b6ec_0_5",
          "kind": "shape",
          "transform": {
            "scaleX": 0.3961,
            "scaleY": 0.1488,
            "translateX": 5083300.5024999995,
            "translateY": 3758400,
            "unit": "EMU"
          },
          "size": {
            "width": {
              "magnitude": 3000000,
              "unit": "EMU"
            },
            "height": {
              "magnitude": 3000000,
              "unit": "EMU"
            }
          }
        },
        {
          "object_id": "g3f139a0b6ec_0_6",
          "kind": "shape",
          "transform": {
            "scaleX": 0.5534,
            "scaleY": 0.1488,
            "translateX": 6935773.53,
            "translateY": 3758400,
            "unit": "EMU"
          },
          "size": {
            "width": {
              "magnitude": 3000000,
              "unit": "EMU"
            },
            "height": {
              "magnitude": 3000000,
              "unit": "EMU"
            }
          }
        },
        {
          "object_id": "g3f139a0b6ec_0_7",
          "kind": "shape",
          "transform": {
            "scaleX": 0.641,
            "scaleY": 0.1608,
            "translateX": 3216598.5300000003,
            "translateY": 4148550,
            "unit": "EMU"
          },
          "size": {
            "width": {
              "magnitude": 3000000,
              "unit": "EMU"
            },
            "height": {
              "magnitude": 3000000,
              "unit": "EMU"
            }
          }
        },
        {
          "object_id": "g3f139a0b6ec_0_8",
          "kind": "shape",
          "transform": {
            "scaleX": 0.6138,
            "scaleY": 0.1608,
            "translateX": 5083300.5024999995,
            "translateY": 4148550,
            "unit": "EMU"
          },
          "size": {
            "width": {
              "magnitude": 3000000,
              "unit": "EMU"
            },
            "height": {
              "magnitude": 3000000,
              "unit": "EMU"
            }
          }
        },
        {